{
  "schema": "vela.math.fc-audit.agent-handoff-receiver-output.v0.2",
  "fixture_id": "vacuity-erdos-80-4830",
  "condition": "compact_attributed_handoff",
  "packet_root": "sha256:c6d59ef8a0d4bc7dfcca0315aeca0cc72eab03f2d82f796028e9bf2ba92c46cd",
  "sender_output_sha256": "sha256:5e63d10b5b3dc8f186df6ac9e97e926ba764e8b4aacdf5eb91272342a714ab65",
  "retained_verdict": "needs_revision",
  "retained_issue_codes": [
    "vacuous_hypothesis"
  ],
  "provenance_bindings": {
    "source_commit": "e2e2a6064b474781d3b5b4a32e3d77956d6968da",
    "source_path": "FormalConjectures/ErdosProblems/80.lean",
    "source_raw_sha256": "sha256:519cc02b3389c89bc87c16d548c6b028e6bb2c1c3bad410a1758f470de18de4e",
    "sender_output_sha256": "sha256:5e63d10b5b3dc8f186df6ac9e97e926ba764e8b4aacdf5eb91272342a714ab65",
    "original_packet_root": "sha256:c6d59ef8a0d4bc7dfcca0315aeca0cc72eab03f2d82f796028e9bf2ba92c46cd",
    "evidence_locators_retained": true,
    "authority_effect": "none"
  },
  "continuation_summary": "The sender verdict and issue code are retained. The quantified range permits c=2, for which Admissible is impossible for every n>=1 because it requires at least 2*n^2 edges while a simple n-vertex graph has at most n(n-1)/2. Thus f 2 n=0 and the claimed eventual strict lower bound by n^epsilon fails. Exact source, audit-check, build-check, and pull-request locators are retained.",
  "reproduction_terminal_state": "completed",
  "missing_provenance_fields": [],
  "next_action": "Revise both asymptotic statements to restrict c to a satisfiable density range, such as 0<c<1/2, then mechanically check and semantically review the exact revised artifact; PR 4877 is only an open community observation here.",
  "unsupported_claims": [],
  "authority_effect": "none",
  "does_not_establish": [
    "The successful exact-head build establishes compilation only, not semantic fidelity, mathematical truth, acceptance, or Standing.",
    "The approval and merge of PR 4830 do not establish acceptance or Standing for this evaluation.",
    "The retained advisory audit establishes the exhibited vacuity defect, not a replacement theorem or the truth of a corrected conjecture.",
    "Skipped and unrelated checks are not established as successful."
  ],
  "confidence": "high"
}
