{
  "schema": "vela.math.fc-audit.agent-handoff-receiver-output.v0.2",
  "fixture_id": "vacuity-erdos-80-4830",
  "condition": "legacy_full_audit_handoff",
  "packet_root": "sha256:c6d59ef8a0d4bc7dfcca0315aeca0cc72eab03f2d82f796028e9bf2ba92c46cd",
  "sender_output_sha256": "sha256:5e63d10b5b3dc8f186df6ac9e97e926ba764e8b4aacdf5eb91272342a714ab65",
  "retained_verdict": "needs_revision",
  "retained_issue_codes": [
    "vacuous_hypothesis"
  ],
  "provenance_bindings": {
    "source_commit": "e2e2a6064b474781d3b5b4a32e3d77956d6968da",
    "source_path": "FormalConjectures/ErdosProblems/80.lean",
    "source_raw_sha256": "sha256:519cc02b3389c89bc87c16d548c6b028e6bb2c1c3bad410a1758f470de18de4e",
    "sender_output_sha256": "sha256:5e63d10b5b3dc8f186df6ac9e97e926ba764e8b4aacdf5eb91272342a714ab65",
    "original_packet_root": "sha256:c6d59ef8a0d4bc7dfcca0315aeca0cc72eab03f2d82f796028e9bf2ba92c46cd",
    "evidence_locators_retained": true,
    "authority_effect": "none"
  },
  "continuation_summary": "Confirmed NEEDS REVISION for vacuous_hypothesis. The exact source quantifies over every c>0; at c=2 no simple n-vertex graph can satisfy the required edge density, so the admissible set is empty, f 2 n=0, and the claimed eventual positive lower bound fails. The exact-head Build project check passed, but that mechanical result does not cure the semantic defect. Approval and merge are community observations only.",
  "reproduction_terminal_state": "scoped",
  "missing_provenance_fields": [],
  "next_action": "Revise both asymptotic statements to restrict c to a satisfiable density range, such as 0<c<1/2, then mechanically check and semantically review the exact revised artifact; the retained PR 4877 observation does not itself establish completion, acceptance, or Standing.",
  "unsupported_claims": [],
  "authority_effect": "none",
  "does_not_establish": [
    "The successful exact-head build establishes compilation only, not semantic fidelity, mathematical truth, acceptance, or Standing.",
    "The approval and merge of PR 4830 do not establish acceptance or Standing for this evaluation.",
    "The retained advisory audit establishes the exhibited vacuity defect, not a replacement theorem or the truth of a corrected conjecture.",
    "Skipped and unrelated checks are not established as successful.",
    "The review and this continuation have no authority effect and do not establish a Formal Conjectures maintainer action or Vela Decision."
  ],
  "confidence": "high"
}
