{
  "schema": "vela.math.fc-audit.agent-handoff-receiver-output.v0.2",
  "fixture_id": "conditional-erdos-427-4884",
  "condition": "compact_attributed_handoff",
  "packet_root": "sha256:511b0fe86e87d6e32f5836e120e29021623347fdbb2fa6ab5655e0595262e23c",
  "sender_output_sha256": "sha256:b7c421b0c58a006c49222d1aac47174a36a2786a125f52165f8dc2739bd26a41",
  "retained_verdict": "minor_issues",
  "retained_issue_codes": [
    "conditional_proof_dependency"
  ],
  "provenance_bindings": {
    "source_commit": "601aff40d6fa6c3150242144fadba5dbcc24c89c",
    "source_path": "FormalConjectures/ErdosProblems/427.lean",
    "source_raw_sha256": "sha256:be54dc1ed87c382e3ec3895f2568278e5c4fec186671b363ec8edd917ac60d71",
    "sender_output_sha256": "sha256:b7c421b0c58a006c49222d1aac47174a36a2786a125f52165f8dc2739bd26a41",
    "original_packet_root": "sha256:511b0fe86e87d6e32f5836e120e29021623347fdbb2fa6ab5655e0595262e23c",
    "evidence_locators_retained": true,
    "authority_effect": "none"
  },
  "continuation_summary": "Confirmed the sender's minor_issues verdict and conditional_proof_dependency issue: Erdos427.erdos_427 is explicitly conditional on erdos_427.variants.shiu. Source fidelity and the exact-head mechanical check passed, while correctness and semantic correspondence of the retained linked proof were not established.",
  "reproduction_terminal_state": "scoped",
  "missing_provenance_fields": [],
  "next_action": "Execute and semantically compare the exact retained linked proof against Erdos427.erdos_427 and its declared ShiuTheorem dependency, or discharge that dependency with an independently verified proof.",
  "unsupported_claims": [
    "The retained metadata review did not execute or semantically compare the linked proof, so linked-proof correctness and full correspondence to the declared ShiuTheorem assumption are not established."
  ],
  "authority_effect": "none",
  "does_not_establish": [
    "An unconditional proof of Erdos427.erdos_427",
    "Correctness of the linked proof or mathematical truth of ShiuTheorem",
    "Success of every check run",
    "Acceptance, merge, maintainer approval, Vela Decision, or Standing"
  ],
  "confidence": "high"
}
