{
  "schema": "vela.math.fc-audit.agent-handoff-receiver-output.v0.2",
  "fixture_id": "clean-source-faithful-min-modulus-4829",
  "condition": "legacy_full_audit_handoff",
  "packet_root": "sha256:57d3fb334b9dc03a80b50f89fda9377aa7c2fa0c563573a532cc260a97317caa",
  "sender_output_sha256": "sha256:a24fb1fa8a75de5e2002569b7bf21ec099c18e1859a9b756be3ffcc49a337c65",
  "retained_verdict": "clean",
  "retained_issue_codes": [],
  "provenance_bindings": {
    "source_commit": "0f8d60f1a5811eb00ad9f12cf8031ee5c1cc215c",
    "source_path": "FormalConjectures/Arxiv/2607.08366/MinModulus.lean",
    "source_raw_sha256": "sha256:abb822a6dd603f95a9c9d773c199399222539c9cd91c8a124a3cc5429d9da416",
    "sender_output_sha256": "sha256:a24fb1fa8a75de5e2002569b7bf21ec099c18e1859a9b756be3ffcc49a337c65",
    "original_packet_root": "sha256:57d3fb334b9dc03a80b50f89fda9377aa7c2fa0c563573a532cc260a97317caa",
    "evidence_locators_retained": true,
    "authority_effect": "none"
  },
  "continuation_summary": "Confirmed the sender's clean verdict with no issue codes. The exact-head source bytes and retained locators support the review: MinModulus.min_modulus faithfully states Conjecture 1 with the necessary positive-modulus guard, the source-author fidelity review applies to identical final-head bytes, and the exact-head repository build check passed. These results remain layer-scoped and confer no acceptance, Standing, or Vela authority.",
  "reproduction_terminal_state": "scoped",
  "missing_provenance_fields": [],
  "next_action": null,
  "unsupported_claims": [],
  "authority_effect": "none",
  "does_not_establish": [
    "mathematical truth of Conjecture 1",
    "acceptance or Standing",
    "Vela Verification or Decision",
    "source fidelity beyond MinModulus.min_modulus",
    "proof correctness of the separately declared solved theorem",
    "that unlisted checks ran"
  ],
  "confidence": "high"
}
